table_name	column_name	data_type	column_descr							
struct2atc	atc_code	character(7)	Drug ATC code							
struct2drgclass	id	integer(32)	DrugCentral table identifier							
struct2drgclass	struct_id	integer(32)	DrugCentral structure id for drug							
struct2drgclass	drug_class_id	integer(32)	Drug class identifier from DrugCentral							
struct2obprod	struct_id	integer(32)	DrugCentral structure id for drug							
struct2obprod	prod_id	integer(32)	DrugCentral drug product identifier							
struct2obprod	strength	character varying(4000)	Concentration of the active substance							
struct2parent	struct_id	integer(32)	DrugCentral structure id for drug							
struct2parent	parent_id	integer(32)	DrugCentral parentmol table identifier							
struct_type_def	id	integer(32)	DrugCentral unique identifier for structure type							
struct_type_def	type	character varying(50)	Type of structures defined in DrugCentral							
struct_type_def	description	character varying(200)	Short description of the structure type							
structure_type	id	integer(32)	DrugCentral table identifier							
structure_type	struct_id	integer(32)	DrugCentral structure id for drug							
structure_type	type	character varying(50)	Type of structures defined in DrugCentral							
structures	cd_id	integer(32)	DrugCentral structure id for drug							
structures	cd_formula	character varying(100)	Drug chemical formula							
structures	cd_molweight	double precision(53)	Drug molecular weight							
structures	id	integer(32)	DrugCentral structure ID							
structures	clogp	double precision(53)	Calculated clogP of the drug							
structures	alogs	double precision(53)	Calculated clogS of the drug							
structures	cas_reg_no	character varying(50)	CAS number of the drug							
structures	tpsa	real(24)	Calculated TPSA property of the drug							
structures	lipinski	integer(32)	Calculated Lipinski rule for the drug							
structures	name	character varying(250)	Preffered drug name							
structures	no_formulations	integer(32)	Number of formulations							
structures	stem	character varying(50)	INN STEM of the drug							
structures	molfile	text	Depiction of the chemical structure of the drug							
structures	mrdef	character varying(32672)	Drug description							
structures	enhanced_stereo	boolean	Signals a structure with chiral centers							
structures	arom_c	integer(32)	Calculated number of aromatic C atoms of the drug							
structures	sp3_c	integer(32)	Calculated number of sp3 C atoms of the drug							
structures	sp2_c	integer(32)	Calculated number of sp2 C atoms of the drug							
structures	sp_c	integer(32)	Calculated number of sp C atoms of the drug							
structures	halogen	integer(32)	Calculated number of halogen atoms of the drug							
structures	hetero_sp2_c	integer(32)	Calculated number of hetero and sp2 C atoms of the drug							
structures	rotb	integer(32)	Number of rotatable bonds							
structures	molimg	bytea	Image file of the chemical structure of the drug							
structures	o_n	integer(32)	Number of H-bond acceptor							
structures	oh_nh	integer(32)	Number of H-bond donors							
structures	inchi	character varying(32672)	INCHI code							
structures	smiles	character varying(32672)	SMILES code							
structures	rgb	integer(32)	number of rigid bonds							
structures	fda_labels	integer(32)	Has labels in FDA							
structures	inchikey	character(27)	INCHI KEY							
structures	status	character varying(10)	Drug status regarding patent and/or marketing status od the product containing the drug substance							
synonyms	syn_id	integer(32)	DrugCentral synonim ID							
synonyms	id	integer(32)	DrugCentral structure id for drug							
synonyms	name	character varying(250)	Drug name							
synonyms	preferred_name	smallint(16)	Preffered name of the drug							
synonyms	parent_id	integer(32)	ID of a parent drug							
synonyms	lname	character varying(250)	Synonim names							
target_class	l1	character varying(50)	Target class name							
target_class	id	integer(32)	Unique identifier for target class							
target_component	id	integer(32)	DrugCentral table identifier							
target_component	accession	character varying(20)	Unique entry identifier from UniProtKB							
target_component	swissprot	character varying(20)	Entry name identifier from UniProtKB							
target_component	organism	character varying(150)	The species expressing the target from UniProtKB							
target_component	name	character varying(200)	Target full-name from UniProtKB							
target_component	gene	character varying(25)	Name of the gene encoding the protein from UniProtKB							
target_component	geneid	bigint(64)	Gene identifier from UniProtKB							
target_component	tdl	character varying(5)	Target development level, as defined at http://juniper.health.unm.edu/tcrd/							
target_dictionary	id	integer(32)	DrugCentral table identifier							
target_dictionary	name	character varying(200)	Target full-name from UniProtKB							
target_dictionary	target_class	character varying(50)	DrugCentral target class definition							
target_dictionary	protein_components	smallint(16)	Number of components of a target							
target_dictionary	protein_type	character varying(50)	Target type as defined in DrugCentral							
target_dictionary	tdl	character varying(500)	Target development level, as defined at http://juniper.health.unm.edu/tcrd/							
target_go	id	character(10)	Gene ontology ID							
target_go	term	character varying(200)	Term description							
target_go	type	character(1)	Type of GO term							
target_keyword	id	character(7)	DrugCentral table identifier							
target_keyword	descr	character varying(4000)	Target description							
target_keyword	category	character varying(50)	Term describing the functional category for a target							
target_keyword	keyword	character varying(200)	DrugCentral keyword							
td2tc	target_id	integer(32)	Target ID extracted from target_dictionary table							
td2tc	component_id	integer(32)	Target ID extracted from target_component table							
tdgo2tc	id	integer(32)	DrugCentral table identifier							
tdgo2tc	go_id	character(10)	Gene ontology ID							
tdgo2tc	component_id	integer(32)	Target ID corresponding to target_component table							
tdkey2tc	id	integer(32)	DrugCentral table identifier							
tdkey2tc	tdkey_id	character(7)	Identifier corresponding to target_keyword table							
tdkey2tc	component_id	integer(32)	Target ID corresponding to target_component table							
